{
  "id": "019a2b3c-4d5e-7f00-8a00-000000000009",
  "route_id": "019a2b3c-4d5e-7f00-8a00-000000000007",
  "name": "Hétköznap éjjel",
  "weekdays": 127,
  "mode": "interval",
  "start_times": null,
  "interval_from": "00:00",
  "interval_to": "23:55",
  "interval_every_min": 5,
  "time_limit_min": 20,
  "active": true,
  "created_at": "2026-10-20T08:00:00.000Z",
  "updated_at": "2026-10-27T10:05:12.345Z"
}
