{
  "id": "019a2b3c-4d5e-7f00-8a00-000000000009",
  "route_id": "019a2b3c-4d5e-7f00-8a00-000000000007",
  "name": "Hétvége",
  "weekdays": 96,
  "mode": "list",
  "start_times": [
    "20:00",
    "22:30",
    "01:00",
    "04:00"
  ],
  "interval_from": null,
  "interval_to": null,
  "interval_every_min": null,
  "time_limit_min": null,
  "active": true,
  "created_at": "2026-10-20T08:00:00.000Z",
  "updated_at": "2026-10-27T10:05:12.345Z"
}
